{
  "checkpoint": "post_writer",
  "verdict": "accept_with_notes",
  "overall_score": 81,
  "rubric": {
    "hook": 84,
    "fact_accuracy": 82,
    "emotional_variation": 76,
    "immersion": 82
  },
  "feedback": "도입 장면의 긴장감은 강하지만 4번 장면과 5번 장면 사이의 감정 대비를 조금 더 벌리면 유지력이 더 좋아집니다.",
  "scene_notes": [
    {
      "scene_num": 1,
      "issue": "첫 문장이 충분히 짧지만 후반 설명이 조금 길어집니다.",
      "suggestion": "두 번째 문장을 더 잘게 끊어서 충격 리듬을 유지하세요."
    }
  ],
  "precheck": {
    "schema_valid": true,
    "forbidden_term_hits": [],
    "short_circuited": false
  },
  "critic_model": "gpt-test-critic",
  "critic_provider": "anthropic",
  "source_version": "v1-critic-post-writer"
}
